"Accession","Family","Genus","Country","State","County","Locality","Date","Collector"
9038530,"Telemidae","Usofila","USA","California","Amador","Connie's Cave, 0.5 mi NW Volcano","25/3/1995","D Ubick"
9038531,"Telemidae","Usofila","USA","California","Amador","Lulu Bell Cave, nr Volcano","17/10/1987","D Ubick"
9038532,"Telemidae","Usofila","USA","California","Amador","Moss Cave, nr. Volcano","17/10/1987","D Ubick"
9038533,"Telemidae","Usofila","USA","California","Amador","Pardee Res., Chrome Cave","24/1/1981","D Ubick"
9038534,"Telemidae","Usofila","USA","California","Amador","Pardee Res., Chrome Cave","21/9/1980","TS Briggs, D Ubick"
9038535,"Telemidae","Usofila","USA","California","Amador","Pearl Cave, 0.2 mi. NE Volcano","13/9/1980","TS Briggs, D Ubick"
9038536,"Telemidae","Usofila","USA","California","Amador","Sutter Creek Cave, WSI #C-61, 3 mi w Volcano","15/7/1995","D Ubick, T Briggs, W Rauscher"
9038537,"Telemidae","Usofila","USA","California","Amador","Connie's Cave, 0.5 mi N Volcano","15/4/1979","Rudolph, Winterath, VanIngen, Dowan"
